ID,Text,Category
15846,It's gotten a little nasty.,No
15847,It's not much fun sometimes.,No
15848,And I would cite again Dan Quayle.,No
15849,"I've been in politics a long time, and I don't remember that kind of piling on, that kind of ugly rumor that never was true, printed.",No
15852,But he's in the arena.,No
15855,So I salute these things.,No
15857,Sam Raybum had a great expression on this.,No
15858,He said here were all these intellectuals out there griping and complaining and saying it was negative coverage.,No
15860,"Michael Dukakis has run for sheriff, and so has George Bush.",No
15863,I thank you for that.,No
15866,"And doesn't that prove the point, George, which is that values like family and education and community, decent homes for young people that family on Long Island I visited on Monday where Lou and Betty Tolamo (phonetic) bought a house for some $19,000 back in 1962, have had seven children, they're all making good livings.",No
15870,I think you believe in them.,No
15871,They're not left or right.,No
15873,"I guess the one thing that concerns me about this, Ann, is this attempt to label things which all of us believe in.",No
15875,We may think that you deal with them in different ways.,No
15878,I think the vast majority of Americans believe in them.,No
15882,I think the American people would appreciate that.,No
15890,"Barb and I lost a child, you know that we lost a daughter, Robin.",No
15893,"He said, no, she has leukemia, acute leukemia, a few weeks to live.",No
15894,We took the child to New York.,No
15895,"Thanks to the miraculous sacrifice of doctors and nurses, the child stayed alive for six months and then died.",No
15896,"If that child were here today, and I was told the same thing, my granddaughter, Noel for example that child could stay alive for ten or fifteen years, or maybe for the rest of her life.",No
15897,And so I don't think that you make an exception based on medical knowledge at the time.,No
15898,"I think human life is very, very precious.",No
15899,"And, look, this hasn't been an easy decision for me to meet.",No
15900,I know others disagree with it.,No
15904,"And I don't assail him on that issue, or others on that issue.",No
15908,"Margaret, Kitty and I had very much the same kind of experience that the Bushes had: we lost a baby, lived about twenty minutes after it was born.",No
15909,"But isn't the real question that we have to answer not how many exceptions we make, because the vice president himself is prepared to make exceptions.",No
15910,"It's who makes the decision, who makes this very difficult, very wrenching decision?",No
15911,"(Applause) And I think it has to be the woman, in the exercise of her own conscience and religious beliefs, that makes that decision.",No
15912,"Who are we to say, well, under certain circumstances, it's all right, but under other circumstances it isn't?",No
15913,"That's a decision that only a woman can make, after consulting her conscience and consulting her religious principles.",No
15923,"No, I don't happen to share that goal.",No
15924,"It's an example of how oftentimes we may be associated with organizations all of whose particular positions we don't support, even though we support in general the hope that over time, particularly if we can get those reductions in strategic weapons, if we can get a comprehensive test ban treaty, if we can negotiate with the Soviet Union and bring down the level of conventional forces in Europe with deeper cuts in the Soviet side, yes, at some point it may be possible to reduce defense outlays and use those for important things here at home, like jobs and job training and college opportunity and health and housing and the environment and the things that all of us care about.",No
15925,"But I do think this, that the next president, even within a relatively stable budget and that's what we are going to have for the foreseeable future will have to make those tough choices that I was talking about and that Mr. Bush doesn't seem to want to make.",No
15928,"And if we can do that and do it in a way that gets deeper cuts on the Soviet side, which is where they ought to come from, then I think we have an opportunity over the long haul to begin to move some of our resources from the military to important domestic priorities that can provide college opportunity for that young woman whose mother wrote me from Texas just the other day, from Longview, Texas: two teachers, a mother and a father who have a child that's a freshman in college, an electrical engineering major, a very bright student and they can't afford to keep that child in college.",No
15929,So I hope that we can begin to move those resources.,No
15935,This is a big question.,No
15936,And it's a question as to whether the United States will continue to lead for peace.,No
15940,"So, what I'm saying is, we are going to have to make choices.",No
15942,"But while the President is negotiating with the Soviet Union, I simply do not want to make these unilateral cuts.",No
15943,And I think those that advocated the freeze missed the point that there was a better way and that better way has resulted in a principle asymmetrical cuts.,No
15944,The Soviets take out more than we do and the principle of intrusive verification.,No
15945,"And those two principles can now be applied to conventional forces, to strategic forces, provided",No
15953,"And some domestic programs as well, Andrea.",No
15961,"As a matter of reality, Fm going to have to because we have had not one but two detailed studies which indicate that there are billions and billions of dollars to be collected that are not being paid these are not taxes owed by average Americans.",Yes
15964,But it's the Internal Revenue Service which estimates now that we aren't collecting $100 billion or more in taxes owed in this country.,Yes
15968,"The point is you've got to have a president who's prepared to do this and to begin right away and, preferably, a president who was a governor of a state that's had very, very successful experience at doing this.",No
15971,Republican governors as well as Democratic governors.,No
15975,"But, the fact of the matter is that this is something that we must begin it's going to take at least the first year of the new administration.",No
15976,"But, the Dorgan Task Force, the bipartisan task force estimated that we could collect about $35 billion in the fifth year, $105 billion over five years, the other study even more than that",Yes
15978,and that's where you begin.,No
15980,"Well, Andrea, you didn't predicate that lack of economists' support for what I call a flexible freeze, because some good very good economists do support that concept.",No
15983,I am optimistic and I believe we can keep this longest expansion going.,No
15984,"I was not out there when that stock market dropped wringing my hands and saying this was the end of the world as some political leaders were, because it isn't the end of the world.",No
15986,And we are doing a better job of it.,No
15990,The American working man and woman are not taxed too little.,No
15991,The Federal Government continues to spend too much.,No
15997,More so you than me.,No
16005,"So, I don't want to fool around with it.",No
16007,It always works that way.,No
16009,In precinct politics in Texas and I've seen it at the national level.,No
16010,We have made the Social Security Trust Fund sound.,No
16011,And it is going to be operating at surpluses and I don't want the liberal Democratic Congress to spend out of that Social Security Trust Fund or go and take the money out for some other purpose.,No
16013,And I will not go in there and suggest changes in Social Security.,No
16016,"And I am going to keep that Social Security Trust Fund sound and keep our commitment to the elderly and maybe down the line, maybe when you get two decades or one into the next century, you're going to have to take another look at it, but not now.",No
16021,"George Bush, a few years ago, said that Social Security was basically a welfare system.",Yes
16027,"The reason that we raise concerns, not just in election years, but every year, because Republicans, once they're elected and start cutting.",No
16030,And I'm sure you'll try to do it again.,No
16031,Because there's no way you can finance what you want to spend.,No
16037,One I don't have a list yet.,No
16038,"I feel pretty confident tonight, but not that confident.",No
16040,"Secondly, I don't have any litmus test.",No
16041,"But what I would do is appoint people to the Federal Bench that will not legislate from the Bench, who will interpret the Constitution.",No
16042,I do not want to see us go to again and Fm using this word advisedly a liberal majority that is going to legislate from the Bench.,No
16045,There is no litmus test on any issue.,No
16052,If the Vice President of the United States thinks that Robert Bork was an outstanding appointment (Cheers and Applause),No
16053,that is a very good reason for voting for Mike Dukakis and Lloyd Bentsen on the 8th of November.,No
16055,And I think the Vice President supported the Bork nomination.,No
16057,"I've appointed over 130, so I have a record.",Yes
16059,And I'm very proud of it.,No
16060,I don't ask people whether they're Republicans or Democrats.,No
16061,"I've appointed prosecutors, I've appointed defenders.",No
16064,And those are the standards that I will use in nominating people to the Supreme Court of the United States.,No
16074,"Andrea, why do people who want balanced budgets or to bring the deficit down always go to those programs which tend to benefit people of very modest means?",No
16078,"Yes, we now have catastrophic health insurance, but it's going to cost, and that's going to be an additional burden on elderly citizens.",No
16082,Now there are some things we can do to help people who currently do get entitlements to get off public assistance.,No
16088,"But let me simply say for the record, I did not vote to cut COLAs.",Yes
16091,So I don't believe that we need to do what you've suggested here.,No
16094,And I have made some good sound proposals.,No
16095,"But again, we have a big difference on child care, for example.",No
16096,"You see, I want the families to have the choice.",No
16097,I don't want to see the Federal Government licensing grandmothers.,No
16098,"I don't want to see the Federal Government saying to communities, well, you can't do this any more.",No
16102,And I want to keep it alive in child care and in other entitlements.,No
16109,That is absolutely not true.,No
16112,It had nothing to do with the debate on Social Security.,No
16115,"No, and I have to (Applause)",No
16121,"But everybody knew that those of us who voted against the freezing of COLAs did so, we did so emphatically.",No
16124,I want to move ahead.,No
16126,I'm interested in 240 million points of light.,No
16127,"I'm interested in 240 million citizens in this country who share in the American dream, all of them in every part of this country.",No
16128,"But as we look at the decisions that the next president of the United States is going to have to make, I just don't believe the place you go first is those programs, those so-called entitlements, which provide a basic floor of income and a modest amount of medical care for the elderly, the disabled, for people who can't make their way on their own, and in many cases, have given a great deal to this country.",No
16132,"It's something that we pay into now so that we will have a secure retirement, and our parents and grandparents will have a secure retirement.",No
16134,So that's not where we ought to go.,No
16135,There are plenty of places to cut.,No
16137,There are we certainly ought to be able to,No
16139,"Give our farm families a decent income with spending $20to $25 billion a year on farm subsidies, and I'm sure we can do that.",No
16142,"Well, let me take him up on this question of farm subsidies.",No
16143,"We have a fundamental difference, approach on agriculture.",No
16144,He favors this supply maintenance or production controls.,No
16149,"And I believe the answer to the agricultural economy is not to get the government further involved, but to do what I'm suggesting.",No
16152,And we ought to expand our markets abroad.,No
16157,The farm payments are going down because the agricultural economy is coming back.,Yes
16168,"It's almost you remember that expression, get the lead out?",No
16173,But what I'm not for what I'm not for is measuring it the way that the Democratic Congress does.,No
16174,"We sent up a good bill on clean water, a sound bill on clean water.",No
16175,"But the only way you can express your love for clean water is to double the appropriations for clean water, and then rant against the deficit.",No
16176,I am for clean water.,No
16177,I've been an outdoorsman and a sportsman all my life.,No
16178,I've been to these national parks.,No
16180,"I headed the task force when I was a member of the Congress way back in the late '60s on these kinds of things, on the Republican side.",No
16182,And so I refuse to measure one's commitment as to whether you're going to double the spending.,No
16185,I'm not going to go down there and try to dump the sludge from Massachusetts off the beaches off of New Jersey.,No
16188,"Can you add five seconds, Bernie, out of fairness?",No
16189,"Come on, give me five.",No
16190,"I mean, this guy, this is too much.",No
16191,But I'm not going to do that.,No
16195,"And I'll do a good job, because I am committed.",No
16198,"Margaret, I'm not sure I can get all of this in in one minute.",No
16202,I'm against the grain embargo; it was a mistake.,No
16203,"I'm also against the pipeline embargo, which you folks attempted to impose.",Yes
16208,"George, Boston Harbor was polluted for 100 years.",Yes
16228,The American people are up to here with debates.,No
16232,I've spelled out my position.,No
16234,But take a look at the Democratic convention take a look at it.,No
16241,"Because you are so interested in a poll that might have been coming out, or because somebody had said something nasty about somebody else.",No
16242,And so I don't know what the answer is.,No
16245,"So I think we can all share, with respect, in the fact that maybe the message is not getting out.",No
16247,There will be no more debates.,No
16250,"I can understand, after the vice presidential debate, why Mr. Bush would want no more debates.",No
16252,"Andrea, I think we both have a responsibility to try to address the issues.",No
16253,"Yes, we have fundamental differences.",No
16254,I think a great many of them have come out today.,No
16255,"And I think if we get rid of the labels--and I'm not keeping count, but I think Mr. Bush has used the label ""liberal"" at least ten times if I had a dollar, George, for every time you used that label, I'd qualify for one of those tax breaks for the rich that you want to give away.",No
16261,I am concerned about what that does to our future.,No
16262,I'm concerned about the fact that so many of our securities are in the hands of foreign banks because of these massive deficits.,Yes
16268,"I think we ought to be looking at modernization, I think we ought to be exploring less expensive ways to get it on land, and we ought to make sure that we have an effective and strong and credible nuclear deterrent.",No
16270,"And every defense expert I know, including people in the Pentagon itself, will tell you that given the level of defense spending and the level of defense appropriations which the Congress has now approved and the president has signed, there's no way that you can do all of these things and do them well.",No
16271,"That's why tough choices will be required, choices I am prepared to make, Mr. Bush is not prepared to make.",No
16272,"But, Andrea, I think we can go far beyond this as well, because we have opportunities now step-by-step to bring down the level of strategic weapons, get a test ban treaty, negotiate those conventional force reductions.",No
16278,"I've met with them, I know them, I've spent time in South America-speak the language, so does Senator Bentsen.",No
16279,"We want to work with them and build a new relationship, and they with us.",No
16282,Those are the kinds of priorities for national security and for foreign policy that I want to pursue Mr. Bush and I have major differences on these issues and I hope very much to be president and pursue them.,No
16284,"In terms of regional tensions, we have now gotten the attention of the Soviet Union.",No
16287,"It now looks, because of steady negotiation, that we may have an agreement that will remove the Cubans from Angola.",No
16288,We see the Russians coming out of Afghanistan.,No
16289,"That wouldn't have stopped if we hadn't been willing wouldn't have even started, the Soviets coming out, if we hadn't even been willing to support the freedom fighters there.",No
16291,"Those Sandinistas came in and betrayed the trust of the revolution; they said it was about democracy, and they have done nothing other than solidify their Marxist domination over that country.",No
16296,"Well, it's a great concern of mine and I think of all Americans, and perhaps the vice president can tell us what's been going on.",No
16298,"An administration which wants to billions on weapons systems that we don't need and can't afford, and now confronts us with a very serious problem, and plants that are supposed to be producing tritium and plutonium and providing the necessary materials for existing weapons.",No
16304,Why are these plants being closed down?,No
16305,"I don't know what the latest cost estimates are, but it's going to be in the range of 25, 50, 75, $100 billion.",No
16306,"Now, somebody has to bear the responsibility for this.",No
16311,"That is the closest I have ever heard the Governor of Massachusetts come to support anything having to do with nuclear, that's about as close as I've ever heard him Yes, this Savannah River plant needs to be made more safe.",No
16312,Will he join me in suggesting that we may need another plant?,No
16317,"I believe that the more dependent we become on foreign oil, the less our national security is enhanced.",No
16322,and must do what he's talking about now.,No
16328,"Yes, and I'll apply it to Congress too.",No
16331,"Because I think you see, I am one who I get kidded by being a little old fashioned on these things, but I do believe in public service.",No
16333,And I don't think anybody has a call on people in their Administrations going astray.,No
16336,"And yet this man, the governor, equated the President to a rotting fish.",No
16339,I will have an ethical office in the White House that will be under the President's personal concern.,No
16341,"I hope I will do a good job as one who has had a relatively clean record with no conflicts of interest in his own public life, as has the Governor, to exhort young people to get into public service.",No
16342,"But there is no corner on this sleaze factor, believe me.",No
16343,"And it's a disgrace, and I will do my level best to clean it up, recognizing that you can't legislate morality.",No
16344,"But I do believe that with my record in Congress, having led the new Congressmen to a code of ethics through major main emphasis on it in full disclosure, that I've got a good record.",No
16345,"And there are more, if you want to talk about percentage appointments, more Members of Congress who have been under investigation percentage-wise that people in the executive branch.",Yes
16346,And so it isn't one and state governments have had a tough time.,No
16347,His some of his college presidents aren't exactly holier than thou.,No
16349,"Let's say, this isn't Democrat or Republican, and it isn't liberal or conservative.",No
16350,Let's vow to work together to do something about it.,No
16353,"But here again, I don't know which George Bush I'm listening to.",No
16362,I think that says a great deal to the American people about the standards we'll set and the quality of the people that we will pick to serve in our Administration.,No
16368,"28 years ago, as a young man just graduated from law school, I came to this city, came clear across the country, to watch John Kennedy be nominated for the presidency of the United States, right here in Los Angeles.",No
16369,I never dreamed that some day I would win that nomination and be my party's nominee for president.,No
16371,That's why I'm proud and grateful to be a citizen of this country.,No
16377,"But I don't think we can be satisfied when we're spending $150 billion a year in interest alone on the national debt, much of it going to foreign bankers; or when 25 percent of our high school students are dropping out of school; or when we have 2-1/2 million of our fellow citizens, a third of them veterans, who are homeless and living on streets and in doorways in this country, when Mr. Bush's prescription for our economic future is another tax giveaway to the rich.",Yes
16378,We can do better than that.,No
16379,"Not working with government alone, but all of us working together.",No
16380,"Lloyd Bentsen and I are optimists, and so are the American people.",No
16381,"And we ask you for our hand for your hands and your hearts, and your votes on the 8th of November so we can move forward in the future.",No
16382,Kitty and I are very grateful to all of you for the warmth and the hospitality that you've given to us in your homes and communities all across this country.,No
16385,"Thank you, and God bless you.",No
16389,"So let me repeat, I do have respect for my opponent, for his family, for the justifiable pride he takes in his heritage.",No
16390,But we have enormous differences.,No
16393,Because I mean it when I say I want a kinder and gentler nation.,No
16395,"I want to keep our neighborhoods much, much better in terms of anti-crime, and that's why I would appoint judges that have a little more sympathy for the victims of crime and a little less for the criminals.",No
16396,That's why I do feel if some police officer is gunned down that the death penalty is required.,No
16399,This election is about big things.,No
16400,And perhaps the biggest is world peace.,No
16401,And I ask you to consider the experience I have had in working with a President who has revolutionized the situation around the world.,No
16404,I want to build on that.,No
16405,"I'd love to be able to say to my grandchildren, four years after my first term, I'd like to say, your grandfather, working with the leaders of the Soviet Union, working with the leaders of Europe, was able to ban chemical and biological weapons from the face of the earth.",No
16407,"And he was right then, and we still are the last best hope of man on earth.",No
16409,And I will be a good president.,No
16411,"Thank you very, very much.",No
16439,"This is uh - an effort that ought to be done primarily by strong leadership in the White House, the inspiration of our people, the tapping of uh - business, agriculture, industry, labor and government at all levels to work on this uh project.",No
16440,"We'll never have uh - an end to the inflationary spiral, and we'll never have a balanced budget until we get our people back to work.",No
16441,There are several things that can be done specifically that are not now being done.,No
16442,"First of all, to channel research and development funds into areas that will provide uh large numbers of jobs.",No
16443,"Secondly, we need to have a commitment in the uh private sector uh - to cooperate with government in matters like housing.",No
16446,Here a CCC type program would be appropriate to channel money into the ah - cha- in - in into the sharing with the private sector and also local and state governments to employ young people who are now out of work.,No
16449,"There is uh - uh an additional factor that needs to be done and covered very - very succinctly, and that is, to make sure that we have a good relationship between management - business on the one hand, and labor, on the other.",No
16450,In a > Transfer interrupted!,No
16451,"ery high, we might channel specific uh targeted job - job - uh opportunities by paying part of the salary of unemployed people - uh and also sharing with uh - local governments the uh - payment of salaries which would uh - let us cut down the unemployment rate much lower, before we hit the inflationary level.",No
16454,"Yes, in unemployment that is likely to create additional pressure on prices, how willing are you to consider an incomes policy, in other words, wage and price controls?",No
16455,Well - we now have such uh - a low utilization of uh - our productive capacity - uh about 73 percent; I think it's about the lowest since the Great Depression years - and such a high unemployment rate now - uh 7.9 percent - that - uh we have a long way to go in getting people to work before we have the inflationary pressures.,Yes
16456,"And I think this would uh - this would be uh easy to accomplish, to get jobs down, without having strong in- inflationary pressures that - that would be necessary.",No
16458,But with tax incentives for the low-income groups we could build up their uh - income levels uh - above the poverty level and not uh make welfare more uh - profitable than - than work.,No
16461,I notice particularly that he didn't endorse the Humphrey-Hawkins bill which he has on occasions and which is included as a part of the Democratic platform.,Yes
16463,"It would've called for export controls on agricultural products In my judgment the best way to get jobs is to uh - expand the private sector, where five out of six jobs today exist in our economy.",Yes
16464,We can do that by reducing Federal taxes as I proposed uh - about a year ago when I called for a tax reduction of $28 billion - three-quarters of it to go to private uh taxpayers and uh one-quarter to the business sector.,Yes
