ID,Text,Category
24212,Give me a chance to create these kind of jobs in America.,No
24218,"I've already put forward things that'll get this country working fast, some of which have been echoed here tonight--investment tax allowance, capital gains reduction, more on research and development, tax credit for first-time home buyers.",No
24219,"What I'm going to do is say to Jim Baker when this campaign is over, all right, let's sit down now, you do in domestic affairs what you've done in foreign affairs, be kind of the economic coordinator of all the domestic side of the House, and that includes all the economic side, all the training side, and bring this program together.",No
24220,"We're going to have a new Congress, and we're going to say to them, you've listened to the voters the way we have.",No
24221,"Nobody wants gridlock anymore, and so let's get the program through.",No
24222,"And I believe it'll work because, as Ross said, we got the plans.",No
24223,The plans are all over Washington.,No
24225,And so I'll just be asking for support to get that put into effect.,No
24232,"But frankly, I don't think that's the problem today.",No
24237,"But I think the important thing--the important thing-- is to use the powers the president does have on the assumption that, given the condition of this economy, we're going to keep interest rates down if we have the discipline to increase investment and reduce the debt at the same time.",No
24239,I think the American people are ready for action.,No
24241,"Someone who will not veto a bill that has an investment tax credit, middle class tax relief, research and development tax credits as Mr. Bush has done.",Yes
24243,I don't have to worry in the near term about the Federal Reserve.,No
24244,"Their policies so far, it seems to me, are pretty sound.",No
24250,"I've had some arguments with him about the speed in which we might have lowered interest rates, but Governor Clinton, he talks about the reaction to the markets.",No
24257,"And I'm going to keep on vetoing them, because I don't think we're taxed too little.",No
24258,I think the government's spending too much.,No
24259,So Governor Clinton can label it tax for the rich or anything he wants.,No
24260,"I'm going to protect the working man by continuing to veto, and to threaten to veto until we get this new Congress, and then we're going to move forward on our plan.",No
24265,These interest rates we have now don't make any sense.,No
24266,"We have a four trillion dollar debt, and only in America would you finance seventy percent of it five years or less.",Yes
24269,"We have a four percent gap between what we pay for treasuries, and what Germany pays for one to five year treasuries.",Yes
24270,"That gap is going to close, because the Arabs, the Japanese and folks in this country are going to start buying German treasuries because they can get more money.",No
24271,"Every time our interest rates go up one percent, that adds 28 billion dollars to the deficit or to the debt.",Yes
24274,"Just think in your own business, if you had all of your long term problems financed short term.",No
24275,You'd go broke in a hurry.,No
24280,"Again, if you're not rich, you're not a superpower.",No
24281,So we have two that I'd put as number one.,No
24283,"One is we've got to have the money to be able to pay for defense, and we've got to manufacture here.",No
24286,"See, Willow Run could be converted from cars to airplanes in World War II because it was here.",No
24287,We've got to make things here.,No
24289,I hope we can talk more about that.,No
24291,We've got to help Russia succeed in its revolution and all of its republics.,No
24292,"When we think of Russia, remember we're thinking of many countries, now.",No
24293,We've got to help them.,No
24297,It's a very unstable situation.,No
24298,You've got every rich Middle Eastern country over there trying to buy nuclear weapons.,Yes
24300,And that will lead to another five star migraine headache down the road.,No
24302,And we've focused on the tactical.,No
24308,"And number three, we need to help and support Russia and the republics in every possible way to become democratic capitalistic societies, and not just sit back and let those countries continue in turmoil.",No
24309,Because they could go back worse than things used to be.,No
24310,And believe me there are a lot of old boys in the K.G.B.,No
24311,and the military that liked it better the way it used to be.,No
24314,There are three fundamental challenges.,No
24315,"First of all, the world is still a dangerous and uncertain place.",No
24316,"We need a new military and a new national security policy equal to the challenges of a post cold war era, a smaller permanent military force, but one that is more mobile, well trained with high technology equipment.",No
24317,"We need to continue the negotiations to reduce the nuclear arsenals in the Soviet Union, the former Soviet Union, and the United States.",No
24318,We need to stop this proliferation of weapons of mass destruction.,No
24320,Our dollar's at an all time low against some foreign currencies.,Yes
24321,We're weak in the world.,No
24323,"And finally, we ought to be promoting the democratic impulses around the world.",No
24325,They don't go to war with each other.,No
24326,They're reliable friends in the future.,No
24327,"National security, economic strength, democracy.",No
24329,"Well, we still are the envy of the world in terms of our military.",No
24330,There's no question about that.,No
24331,"We're the envy of the world in terms of our economy, despite the difficulties we're having.",No
24332,There's no question about that.,No
24333,Our exports are dramatically up.,Yes
24335,"I mean, that's been done.",Yes
24336,"And thank God, it has, because the parents of these young people around here go to bed at night without the same fear of nuclear war.",No
24338,"And so, we've got a good military.",No
24339,"the question, to sort of get a new military, get the best in the world, we got it, and they're keeping the peace, and they're respected around the world.",No
24340,And we're more respected because of the way we have conducted ourselves.,No
24341,We didn't listen to the nuclear freeze crowd.,No
24344,"But we're so, turned so inward we don't understand the global picture.",No
24345,"And we are helping democracy, Ross.",No
24347,And we're going to keep on doing that.,No
24351,"I think our relationships with China are important and I don't want to isolate China, but I think it is a mistake for us to do what this Administration did when all those kids went out there carrying the Statue of Liberty in Tiananmen Square.",No
24354,That was their response to that sort of action.,No
24355,"Now that the voices in the Congress and throughout the country have insisted that we do something about China, look at what has happened.",No
24359,The second biggest surplus next to Japan.,Yes
24360,So I would be firm.,No
24361,"I would say if you want to continue as Most Favored Nation status for your government owned industries as well as your private ones, observe human rights in the future.",No
24363,Recognize the legitimacy of those kids that were carrying the Statue of Liberty.,No
24367,"Well, the Administration was the first major country to stand up to the abuse in Tiananmen Square.",Yes
24369,We are the ones that lowered the barrier to products with Carla Hill's negotiation.,Yes
24374,We were the first ones to put sanctions on.,Yes
24376,But Governor Clinton's philosophy is isolate them.,No
24377,"He says don't do it, but the policies he's expounding of putting conditions on M.F.N.",Yes
24380,"But you isolate China and turn them inward, and then we've made a tremendous mistake.",No
24381,And I'm not going to do it.,No
24382,"And I've had to fight a lot of people that were saying human rights, and we're the ones that put the sanctions on and stood for it.",Yes
24383,And he can insult General Scowcroft if he wants to.,No
24388,"China, is a huge country, broken into many provinces.",No
24389,It has some very elderly leaders that will not be around too much longer.,No
24391,Asia will be our largest trading partner in the future.,No
24393,"We have a delicate, tight-wire walk that we must go through at the present time to make sure that we do not cozy up to tyrants, to make sure that they don't get the impression that they can suppress their people.",No
24396,I don't want the American people to be confused.,No
24397,"We have written agreements and we have some missiles that have been destroyed, but we have a huge number of intercontinental ballistic missiles that are still in place in Russia.",Yes
24404,And I vowed something because I learned something from Vietnam.,No
24407,American airplanes are helping today on humanitarian relief for Sarajevo.,Yes
24408,It is America that's in the lead in helping with humanitarian relief for Somalia.,Yes
24409,"But when you go to put somebody else's son or daughter into war, I think you got to be a little bit careful and you have to be sure that there's a military plan that can do this.",No
24410,"You have ancient ethnic rivalries that have cropped up as Yugoslavia's dissolved or getting dissolved, and it isn't going to be solved by sending in the 82nd Airborne, and I'm not going to do that as commander-in-chief.",No
24413,We're working through the international organizations.,No
24414,"That's one thing I learned by forging that tremendous and greatly--highly successful coalition against Saddam Hussein, the dictator.",No
24415,Use--work internationally to do it.,No
24417,I am concerned about ethnic cleansing.,No
24425,I think if we learned anything in Vietnam is you first commit this nation before you commit the troops to the battlefield.,No
24427,This is basically a problem that is a primary concern to the European Community.,No
24433,"It's very important that we not just, without thinking it through, just rush to every problem in the world and have our people torn to pieces.",No
24435,I agree that we cannot commit ground forces to become involved in the quagmire of Bosnia or in the tribal wars of Somalia.,No
24436,"But I think that it's important to recognize that there are things that can be done short of that, and that we do have interests there.",No
24438,The US should try to work with its allies and stop it.,No
24439,"I urged the president to support this air cover, and he did--and I applaud that.",Yes
24441,"I think we should stiffen the embargo on the Belgrade government, and I think we have to consider whether or not we should lift the arms embargo now on the Bosnians, since they are in no way in a fair fight with a heavily armed opponent bent on ethnic cleansing.",Yes
24442,"We can't get involved in the quagmire, but we must do what we can.",No
24446,"A good family is a place where love and discipline and good values are transmuted (sic) from the elders to the children, a place where people turn for refuge, and where they know they're the most important people in the world.",No
24447,America has a lot of families that are in trouble today.,No
24452,I've seen the family values of all these people in America who are out there killing themselves working harder for less in a country that's had the worst economic years in 50 years and the first decline in industrial production ever.,Yes
24454,And I think they deserve a family and medical leave act.,No
24455,Seventy-two other nations have been able to do it.,Yes
24456,"Mr. Bush vetoed it twice because he says we can't do something seventy-two other countries do, even though there was a small business exemption.",Yes
24457,"So with all the talk about family values, I know about family values -- I wouldn't be here without them.",No
24458,"The best expression of my family values is that tonight's my 17th wedding anniversary, and I'd like to close my question by just wishing my wife a happy anniversary, and thank you, my daughter, for being here.",No
24461,"Well, I would say that one meeting that made a profound impression on me was when the mayors of the big cities, including the mayor of Los Angeles, a Democrat, came to see me, and they unanimously said the decline in urban America stems from the decline in the American family.",No
24462,So I do think we need to strengthen family.,No
24465,"I'm appalled at the highest outrageous numbers of divorces -- it happens in families, it's happened in ours.",No
24467,And I just think that we ought to do everything we can to respect the American family.,No
24468,It can be a single-parent family.,No
24470,And one way to do it is to get these deadbeat fathers to pay their obligations to these mothers -- that will help strengthen the American family.,No
24471,And there's a whole bunch of other things that I can't click off in this short period of time.,No
24475,They develop a positive or negative self- image.,No
24476,At a very early age they learn how to learn.,No
24477,"If we have children who are not surrounded with love and affection -- you see, I look at my grandchildren and wonder if they'll ever learn to walk because they're always in someone's arms.",No
24480,We will not be a great country unless we have a strong family unit in every home.,No
24491,"No, I don't think that's the right answer.",No
24492,I don't believe legalizing narcotics is the answer.,No
24493,I just don't believe that's the answer.,No
24499,We're using the military more now in terms of interdiction.,Yes
24500,"Our funding for recovery is up, recovering the addicts.",Yes
24502,But where we're not making it is with the confirmed addicts.,No
24503,"And I'll tell you one place that's working well, and that is the private sector -- Jim Burke and this task force that he has, you may know about it.",No
24506,"And people are beginning to educate through this program, teaching these kids you shouldn't use drugs.",No
24507,So we're still in the fight.,No
24508,"But I must tell you, I think legalization of narcotics, or something of that nature, in the face of the medical evidence, would be totally counterproductive.",No
24509,"And I oppose it, and I'm going to stand up and continue to oppose it.",No
24515,"Typical cost to you and me is $125,000.",Yes
24516,"Again and again and again, the mother disappears in 3 days, and the child becomes a ward of the state because he's permanently and genetically damaged.",No
24517,"Just look at those little children, and if anybody can even think about legalizing drugs, they've lost me.",No
24520,-- because we were worried to death that Gaddafi might be building up chemical weapons.,No
24521,"We've got chemical warfare being conducted against our children on the streets in this country all day every day, and we don't have the will to stamp it out.",No
24522,"Now, again, if I get up there, if you send me, we're going to have some blunt talks about this, and we're really going to get down in the trenches and say, is this one you want to talk about or fix, because talk won't do it, folks.",No
24536,"First, we ought to prevent more of this on the street.",No
24538,Now there are three crimes for every policeman.,Yes
24539,We need a hundred thousand more police on the street.,No
24540,I have a plan for that.,No
24541,"Secondly, we ought to have treatment on demand.",No
24542,"Thirdly, we ought to have boot camps for first-time nonviolent offenders so they can get discipline and treatment and education and get reconnected to the community before they're severed and sent to prison, where they can learn how to be first class criminals.",No
24543,"There is a crime bill that, lamentably, was blocked from passage once again, mostly by Republicans in the US Senate, which would have addressed some of these problems.",Yes
24550,This is a relevant question here tonight.,No
24555,"And if we can't love one another, we ought to get along with one another.",No
24556,"And if you can't get there, just recognize we're all stuck with one another because nobody's going anywhere, right?",No
24558,"Now, that ought to get everybody back up to let's get along together and make it work.",No
24560,We've turned it into a weakness.,No
24561,"Now again, the White House is a bully pulpit.",No
24563,"See, our differences are our strengths.",No
24565,"In athletics, we know it.",No
24566,"See, divided teams lose; united teams win.",No
24567,"We have got to unite and pull together, and there's nothing we can't do.",No
24568,"But if we sit around blowing all this energy out the window on racial strife and hatred, we are stuck with a sure loser because we have been a melting pot.",No
24570,"Let's make it a strength, not a weakness.",No
24573,"I grew up in the segregated South, thankfully raised by a grandfather with almost no formal education but with a heart of gold who taught me early that all people were equal in the eyes of God.",No
24574,"I saw the winds of hatred divide people and keep the people of my state poorer than they would have been, spiritually and economically.",No
24575,And I've done everything I could in my public life to overcome racial divisions.,No
24576,We don't have a person to waste in this country.,No
24578,And I have devoted a major portion of this campaign to going across this country and looking for opportunities to go to white groups and African American groups and Latino groups and Asian American groups and say the same thing.,No
24579,"If the American people cannot be brought together, we can't turn this country around.",No
24583,"Well, I think Governor Clinton is committed.",No
24586,We passed two very forward-looking civil rights bills.,Yes
24587,It's not going to be all done by legislation.,No
24589,"I have to take ten seconds here at the end -- the red light isn't on yet -- to say to Ross Perot, please don't say to the DEA agents on the street that we don't have the will to fight drugs.",No
24591,I have watched these people -- the same for our local law enforcement people.,No
24601,Coming from the political process.,No
24602,We have increased funding for AIDS.,Yes
24604,My request for this year was $4.9 billion for AIDS -- ten times as much per AIDS victim as per cancer victim.,Yes
24605,I think that we're showing the proper compassion and concern.,No
24607,"We're funding them -- I wish there was more money -- but we're funding them far more than any time in the past, and we're going to keep on doing that.",Yes
24611,"He went to one meeting, and then we heard that he was stepping down.",No
24613,It was a beautiful moment and I think she'll do a first-class job on that commission.,No
24620,You can't talk about it rationally.,No
24621,The extremes are hurting the AIDS cause.,No
24622,"To go into a Catholic mass in a beautiful cathedral in New York under the cause of helping in AIDS and start throwing condoms around in the mass, I'm sorry, I think it sets back the cause.",No
24625,We've got to continue everything we can at the federal and the local level.,No
24626,Barbara I think is doing a superb job in destroying the myth about AIDS.,No
24627,"And all of us are in this fight together, all of us care.",No
24631,"First, I think Mary Fisher was a great choice.",No
24632,We're lucky to have her heading the commission.,No
24634,Then I would really focus on let's get these things out.,No
24637,And we could be moving out to the human population a whole lot faster than we are on some of these new drugs.,No
24640,"The all- time low in our country was the Judge Thomas-Anita Hill hearings, and those senators ought to be hanging their heads in shame for what they did there.",No
24642,"2nd thing, there are not many times in your life when you get to talk to a whole country.",No
24643,"But let me just say to all of America: if you hate people, I don't want your vote.",No
24644,That's how strongly I feel about it.,No
24647,"Over 150,000 Americans have died of AIDS.",Yes
24649,We need to put one person in charge of the battle against AIDS to cut across all the agencies that deal with it.,No
24650,We need to accelerate the drug approval process.,No
24651,We need to fully fund the act named for that wonderful boy Ryan White to make sure we're doing everything we can on research and treatment.,No
24652,"And the president should lead a national effort to change behavior, to keep our children alive in the schools, responsible behavior to keep people alive.",No
24653,This is a matter of life and death.,No
24657,"I am proud of what we did at the Democratic Convention, putting 2 HIV-positive people on the platform, and I am proud of the leadership that I'm going to bring to this country in dealing with the AIDS crisis.",No
24664,"Number one, if I get there, it will be a very unusual and historical event --",No
24667,I will have a unique mandate.,No
24669,They will want to do what's good for our country.,No
24670,"Now, all these fellows with thousand-dollar suits and alligator shoes running up and down the halls of Congress that make policy now -- the lobbyists, the PAC guys, the foreign lobbyists, and what-have-you, they'll be over there in the Smithsonian, you know --",No
24672,"-- because we're going to get rid of them, and the Congress will be listening to the people.",No
24675,"The American people are bright, intelligent, caring, loving people who want a great country for their children and grandchildren.",No
24676,And they will make those sacrifices.,No
24679,"-- because if the American people send me there, we'll get it done.",No
24680,"Now, everybody will faint in Washington.",No
24681,They've never seen anything happen in that town.,No
24685,"Then when they get off by themselves, they say nobody did it.",No
24687,"And yet the cash register's empty and it used to have our money, the taxpayers' money, in it, and we didn't get the results.",No
24688,"No, we'll get it done.",No
24695,"The average senior citizen is spending a higher percentage of income on health care today than they were in 1965, before Medicare came in.",Yes
24696,The president's got another proposal to require them to pay $400 a year more for the next 5 years.,Yes
24698,Costs will continue to spiral.,No
24699,"And just remember this, folks.",No
24701,"I've met them, people like Mary Annie and Edward Davis in Nashua, New Hampshire.",No
24704,"When we talk about cutting health care costs, let's start with the insurance companies and the people that are making a killing instead of making our people healthy.",No
24707,"Well, first place, I'd like to clear up something because every 4 years, the Democrats go around and say, Republicans are going to cut Social Security and Medicare.",No
24709,"I'm the president that stood up and said, don't mess with Social Security, and I'm not going to and we haven't and we are not going to go after the Social Security recipient.",Yes
24710,I have one difference with Mr. Perot on that because I don't think we need to touch Social Security.,No
24714,"So what we've got to do is control it, let it grow for inflation, let it grow for the amount of new people added, population, and then hold the line.",No
24715,"And I believe that is the way you get the deficit down, not by the tax-and-spend program that we hear every 4 years, whether it's Mondale, Dukakis, whoever else it is.",No
24716,I just don't believe we ought to do that.,No
24717,So hold the line on Social Security and put a cap on the growth of the mandatory program.,No
24729,I thought the Oregon plan should at least have been allowed to be tried because at least the people in Oregon were trying to do something.,No
24730,"Let me go back to the main point, Sandy.",No
24731,Mr. Bush is trying to run against Lyndon Johnson and Jimmy Carter and everybody in the world but me in this race.,No
24735,"The federal government has cut Medicare and Medicaid in the last few years, states have cut Medicaid -- we've done it in Arkansas under budget pressures.",Yes
24737,More and more people get on the rolls as poverty increases.,Yes
24743,"Now, just a few days ago a bipartisan commission of Republicans and Democrats -- more Republicans than Democrats -- said my plan will save the average family $1200 a year more than the Bush plan will by the year 2000, $2.2 trillion in the next 12 years, $400 billion a year by the end of this decade.",Yes
24744,I've got a plan to control health care costs.,No
24746,"And you have to have cost controls, yes.",No
24747,"But keep in mind we are spending 30% more on health care than any country in the world, any country, and yet we have 35 million people uninsured, we have no preventing and primary care.",Yes
24749,"I say if Germany can cover everybody and keep costs under inflation, if Hawaii can cover 98% of their people at lower health care costs than the rest of us, if Rochester, New York, can do it with two-thirds of the cost of the rest of it, America can do it, too.",Yes
24750,I'm tired of being told we can't.,No
24755,"Well, I don't have time in 30 seconds, or whatever -- a minute -- to talk about our health care reform plan.",No
24756,"The Oregon plan made some good sense, but it's easy to dismiss the concerns of the disabled.",No
24757,"As president I have to be sure that those waivers, which we're approving all over the place, are covered under the law.",Yes
24758,Maybe we can work it out.,No
24759,"But the Americans with Disabilities Act, speaking about sound and sensible civil rights legislation, was the most foremost piece of legislation passed in modern times, and so we do have something more than a technical problem.",No
24768,So we don't have the best.,No
24771,"Again, we've got plans lying all over the place in Washington.",No
24773,Now I'm back to square one.,No
24774,"If you want to stop talking about it and do it, then I'll be glad to go up there and we'll get it done.",No
24775,"But if you just want to keep the music going, just stay traditional this next time around, and 4 years from now you'll have everybody blaming everybody else for a bad health care system.",No
