ID,Text,Category
8329,"But I would propose holding that income up not through a type of program that Senator Kennedy has suggested that would raise prices, but one that would indemnify the farmer, pay the farmer in kind uh - from the products which are in surplus.",No
8338,"Uh - I would also suggest that insofar as his statement is concerned, that I think it would be improper for the President of the United States to disclose uh - the instances in which members of his official family had made recommendations, as I have made them through the years to him, which he has accepted or rejected.",No
8340,"Now, I can only say this.",No
8347,Sometimes my advice has been taken.,No
8349,I do not say that I have made the decisions.,No
8350,"And I would say that no president should ever allow anybody else to make the major decisions, The president only makes the decisions.",No
8352,"As far as what experience counts and whether that is experience that counts, that isn't for me to say.",No
8358,I would say that the people now have the opportunity to evaluate his as against mine and I think both he and I are going to abide by whatever the people decide.,No
8360,"Well, I'll just say that the question is of experience and the question also is uh - what our judgment is of the future, and what our goals are for the United States, and what ability we have to implement those goals.",No
8362,There's no certain road to the presidency.,No
8367,The question really is: which candidate and which party can meet the problems that the United States is going to face in the sixties?,No
8374,"I think you have heavy obligations which affect our security, which we're going to have to meet.",No
8375,"And therefore I've never suggested we should uh - be able to retire the debt substantially, or even at all in nineteen sixty-one or two.",Yes
8381,Not reducing the interest -,No
8384,"In my judgment, the hard money, tight money policy, fiscal policy of this Administration has contributed to the slow-down in our economy, which helped bring the recession of fifty-four; which made the recession of fifty-eight rather intense, and which has slowed, somewhat, our economic activity in 1960.",No
8385,"What I have talked about, however, the kind of programs that I've talked about, in my judgment, are uh - fiscally sound.",No
8386,"Medical care for the aged, I would put under social security.",No
8388,"The program - the Javits-Nixon or the Nixon-Javits program - would have cost, if fully used uh - six hundred million dollars by the government per year, and six hundred million dollars by the state.",Yes
8389,"The program which I advocated, which failed by five votes in the United States Senate, would have put medical care for the aged in Social Security, and would have been paid for through the Social Security System and the Social Security tax.",Yes
8390,"Secondly, I support federal aid to education and federal aid for teachers' salaries.",No
8391,I think that's a good investment.,No
8393,"And I think to heap the burden further on the property tax, which is already strained in many of our communities, will provide, will make sh- insure, in my opinion, that many of our children will not be adequately educated, and many of our teachers not adequately compensated.",No
8397,And the only conditions under which I would unbalance the budget would be if there was a grave national emergency or a serious recession.,No
8398,"Otherwise, with a steady rate of economic growth - and Mr. Nixon and Mr. Rockefeller, in their meeting, said a five per cent economic growth would bring by 1962 ten billion dollars extra in tax revenues.",Yes
8399,"Whatever is brought in, I think that we can finance essential programs within a balanced budget, if business remains orderly.",No
8404,As a matter of fact it will be necessary to raise taxes.,No
8406,"That, however, is raising taxes for those who pay Social Security.",No
8409,"And so I would say that in all of these proposals Senator Kennedy has made, they will result in one of two things: either he has to raise taxes or he has to unbalance the budget.",No
8410,"If he unbalances the budget, that means you have inflation, and that will be, of course, a very cruel blow to the very people - the older people - that we've been talking about.",No
8412,I favor that because I believe that's the best way to aid our schools without running any risk whatever of the federal government telling our teachers what to teach.,No
8419,I'm awfully glad you ge- got that question because as you know I got into it at the last of my other question and wasn't able to complete the argument.,No
8420,"Uh - I think that the reason that I voted against having the federal government uh - pay teachers' salaries was probably the very reason that concerned Senator Kennedy when in January of this year, in his kick-off press conference, he said that he favored aid for school construction, but at that time did not feel that there should be aid for teachers' salaries - at least that's the way I read his remarks.",Yes
8421,"Now, why should there be any question about the federal government aiding s- teachers' salaries?",No
8425,We need higher teachers' salaries.,No
8427,"When the federal government gets the power to pay teachers, inevitably in my opinion, it will acquire the power to set standards and to tell the teachers what to teach.",No
8428,I think this would be bad for the country; I think it would be bad for the teaching profession.,No
8429,There is another point that should be made.,No
8430,I favor higher salaries for teachers.,No
8433,"I believe, in other words, that we have seen the local communities and the state assuming more of that responsibility.",No
8434,Teachers' salaries very fortunately have gone up fifty percent in the last eight years as against only a thirty-four percent rise for other salaries.,Yes
8436,But I do not believe that the way to get more salaries for teachers is to have the federal government get in with a massive program.,No
8438,"My objection here is the potential cost in controls and eventual freedom for the American people by giving the federal government power over education, and that is the greatest power a government can have.",No
8440,"When uh - the Vice President quotes me in January, sixty, I do not believe the federal government should pay directly teachers' salaries, but that was not the issue before the Senate in February.",Yes
8441,The issue before the Senate was that the money would be given to the state.,No
8444,"I voted in favor of that proposal and supported it strongly, because I think that that provided assistance to our teachers for their salaries without any chance of federal control and it is on that vote that th- Mr. Nixon and I disagreed, and his tie vote uh - defeated his breaking the tie defeated the proposal.",Yes
8446,"But if the money will go to the states and the states can then determine whether it shall go for school construction or for teachers' salaries, in my opinion you protect the local authority over the school board and the school committee.",No
8449,"That is wholly wrong, wholly in error, and it is a fact that in the last eight years the Democratic Congress has reduced the appropri- the requests for the appropriations by over ten billion dollars.",Yes
8450,That is not my view and I think it ought to be stated very clearly on the record.,No
8451,My view is that you can do these programs - and they should be carefully drawn - within a balanced budget if our economy is moving ahead.,No
8456,Well as you take the bills -,No
8459,It failed because the House did not pass it and the House failed by eleven votes.,Yes
8463,"Secondly, we passed a federal aid to education bill in the Senate.",Yes
8464,It failed to came to the floor of the House of Representatives.,Yes
8465,It was killed in the Rules Committee.,Yes
8466,And it is a fact in the August session that the four members of the Rules Committee who were Republicans joining with two Democrats voted against sending the aid to education bill to the floor of the House.,Yes
8471,We offered an amendment to do so.,Yes
8472,"Forty-four Democrats voted for it, one Republican voted for it.",Yes
8473,And we were informed at the time it came to a vote that if it was adopted the President of the United States would veto it.,Yes
8474,"In my judgment, a vigorous Democratic president supported by a Democratic majority in the House and Senate can win the support for these programs.",No
8477,Well obviously my views are a little different.,No
8478,"First of all, I don't see how it's possible for a one-third of a body, such as the Republicans have in the House and the Senate to stop two-thirds, if the two-thirds are adequately led.",No
8479,"I would say, too, that when Senator Kennedy refers to the action of the House Rules Committee, there are eight Democrats on that committee and four Republicans.",Yes
8482,"When the president exercises his veto power, he has to have the people upo- behind him, not just a third of the Congress.",No
8484,If the majority of the members of the Congress felt that these particular proposals were good issues - the majority of those who were Democrats - why didn't they pass them and send to the President and get a veto and have an issue?,No
8485,The reason why these particular bills in these various fields that have been mentioned were not passed was not because the President was against them; it was because the people were against them.,No
8486,It was because they were too extreme.,No
8487,"And I am convinced that the alternate proposals that I have, that the Republicans have in the field of health, in the field of education, in the field of welfare, because they are not extreme, because they will accomplish the end uh - without too great cost in dollars or in freedom, that they could get through the next Congress.",No
8490,"I would say this; that we, of course, expect to pick up some seats in both in the House and the Senate.",No
8491,"Uh - We would hope to control the House, to get a majority in the House uh - in this election.",No
8492,"We cannot, of course, control the Senate.",No
8493,"I would say that a president will be able to lead - a president will be able to get his program through - to the effect that he has the support of the country, the support of the people.",No
8494,Sometimes we - we get the opinion that in getting programs through the House or the Senate it's purely a question of legislative finagling and all that sort of thing.,No
8498,"Now, I also say that as far as Senator Kennedy's proposals are concerned, that, again, the question is not simply one of uh - a presidential veto stopping programs.",No
8499,You must always remember that a president can't stop anything unless he has the people behind him.,No
8504,I don't think that's extreme at all; and yet nearly two-thirds to three-fourths of the Republicans in the House of Representatives voted against that proposal.,Yes
8506,"It - it was a very uh - because of the defeat of teacher salaries, it was not a bill that uh - met in my opinion the need.",No
8507,"The fact of the matter is it was a bill that was less than you recommended, Mr. Nixon, this morning in your proposal.",Yes
8508,"It was not an extreme bill and yet we could not get one Republican to join, at least I think four of the eight Democrats voted to send it to the floor of the House - not one Republican - and they joined with those Democrats who were opposed to it.",Yes
8509,I don't say the Democrats are united in their support of the program.,No
8516,I think it shows the difference between the two parties.,No
8517,One party is ready to move in these programs.,No
8522,"Well, I think they're serious.",No
8523,I think it's a matter that we should continue to uh - give uh - great care and attention to.,No
8524,We should support uh - the laws which the United States has passed in order to protect us from uh - those who would destroy us from within.,No
8527,The major threat is external and will continue.,No
8529,I agree with Senator Kennedy's appraisal generally in this respect.,No
8531,It is one that will continue to be a problem for years to come.,No
8534,It is also essential in being alert that we be fair; fair because by being fair we uphold the very freedoms that the Communists would destroy.,No
8536,"And, in this connection, I think that uh - we must look to the future having in mind the fact that we fight Communism at home not only by our laws to deal with Communists uh - the few who do become Communists and the few who do become tra- fellow travelers, but we also fight Communism at home by moving against those various injustices which exist in our society which the Communists feed upon.",No
8537,"And in that connection I again would say that while Senator Kennedy says we are for the status quo, I do believe that he uh - would agree that I am just as sincere in believing that my proposals for federal aid to education, my proposals for health care are just as sincerely held as his.",No
8538,The question again is not one of goals - we're for those goals - it's one of means.,No
8545,Too often in appraising whether we are moving ahead or not we think only of what the federal government is doing.,No
8549,Roughly a hundred billion to a hundred and a quarter billion of that is the result of government activity.,Yes
8550,"Four hundred billion, approximately, is a result of what individuals do.",Yes
8555,"Well, I must say that the reason that the schools have been constructed is because the local school districts were willing to increase the property taxes to a tremendously high figure - in my opinion, almost to the point of diminishing returns in order to sustain these schools.",Yes
8557,And I think we have a powerful country.,No
8560,"It isn't enough to compare what might have been done eight years ago, or ten years ago, or fifteen years ago, or twenty years ago.",No
8561,"I want to compare what we're doing with what our adversaries are doing, so that by the year 1970 the United States is ahead in education, in health, in building, in homes, in economic strength.",No
8572,But the reason for that is obvious.,No
8573,They start from a much lower base.,No
8574,"Although they have been moving faster in growth than we have, we find, for example, today that their total gross national product is only forty-four per cent of our total gross national product.",Yes
8575,That's the same percentage that it was twenty years ago.,Yes
8576,"And as far as the absolute gap is concerned, we find that the United States is even further ahead than it was twenty years ago.",Yes
8577,Is this any reason for complacency?,No
8578,Not at all Because these are determined men.,No
8581,I agree with Senator Kennedy completely on that score.,No
8582,Where we disagree is in the means that we would use to get the most out of our economy.,No
8583,"I respectfully submit that Senator Kennedy too often would rely too much on the federal government, on what it would do to solve our problems, to stimulate growth.",No
8584,"I believe that when we examine the Democratic platform, when we examine the proposals that he has discussed tonight, when we compare them with the proposals that I have made, that these proposals that he makes would not result in greater growth for this country than would be the case if we followed the programs that I have advocated.",No
8586,The one in the field of health is worth mentioning.,No
8587,"Our health program - the one that Senator Javits and other Republican Senators, as well as I supported - is one that provides for all people over sixty-five who want health insurance, the opportunity to have it if they want it.",Yes
8589,But it compels nobody to have insurance who does not want it.,No
8592,Here is one place where I think that our program does a better job than his.,No
8593,The other point that I would make is this: this downgrading of how much things cost I think many of our people will understand better when they look at what happened when - during the Truman Administration when the government was spending more than it took in - we found savings over a lifetime eaten up by inflation.,Yes
8595,It is essential that a man who's president of this country certainly stand for every program that will mean for growth.,No
8599,The point was made by Mr. Nixon that the Soviet production is only forty-four percent of ours.,Yes
8600,I must say that forty-four percent and that Soviet country is causing us a good deal of trouble tonight.,No
8602,"I don't want to see the day when it's sixty percent of ours, and seventy and seventy-five and eighty and ninety percent of ours, with all the force and power that it could bring to bear in order to cause our destruction.",No
8606,I think it's a very clear contrast.,No
8607,"In 1935, when the Social Security Act was written, ninety-four out of ninety-five Republicans voted against it.",Yes
8610,"Thirdly, I think the question before the American people is: as they look at this country and as they look at the world around them, the goals are the same for all Americans.",No
8611,The means are at question.,No
8613,"If you feel that everything that is being done now is satisfactory, that the relative power and prestige and strength of the United States is increasing in relation to that of the Communists; that we've b- gaining more security, that we are achieving everything as a nation that we should achieve, that we are achieving a better life for our citizens and greater strength, then I agree.",No
8616,"As I said at the beginning, the question before us all, that faces all Republicans and all Democrats, is: can freedom in the next generation conquer, or are the Communists going to be successful?",No
8619,"If we fail, if we fail to move ahead, if we fail to develop sufficient military and economic and social strength here in this country, then I think that uh - the tide could begin to run against us.",No
8620,"And I don't want historians, ten years from now, to say, these were the years when the tide ran out for the United States.",No
8622,"That's the question before the American people, and only you can decide what you want, what you want this country to be, what you want to do with the future.",No
8624,"And it is to that great task, if we're successful, that we will address ourselves.",No
8661,"Governor Reagan is not responsible for what has happened over the last four years, nor am I.",No
8662,The man who should be here tonight to respond to those charges chose not to attend.,No
8663,But I want to answer as specifically as I can the question that you have just put to me.,No
8667,"Even though we've seen some hopeful signs, perhaps, in the flash report on the third quarter, that perhaps the economy is coming out of the recession, we've also seen the rise in the rate of the prime; we have seen mortgage rates back up again, a sure sign of inflation in the housing industry.",Yes
8669,I think we've got to have fiscal restraint.,No
8670,"And I said at that time that one of the things that we could do, that perhaps would save as much as $5 billion to $7 billion, according, to one of the leading members of the House Budget Committee, was to recalculate the index that is used to determine the cost of living benefits that are paid to civil service retirees, to military retirees.",Yes
8674,"fiscal restraint, I think is necessary.",No
8679,"I believe that the only unpopular measures, actually, that could be, or would be applied, would be unpopular with the government, and with those.",No
8681,"I believe that inflation today is caused by government simply spending more than government takes in, at the same time that government has imposed upon business and industry, from the shopkeeper on the corner to the biggest industrial plant in America, countless harassing regulations and punitive taxes that have reduced productivity at the same time they have increased the cost of production.",No
8684,You are robbing the American people of their savings.,No
8686,"Now, I know that this has been called inflationary by my opponent and by the man who isn't here tonight.",No
8687,"But I don't see where it is inflationary to have people keep more of their earnings and spend it, and it isn't inflationary for government to take that money away from them and spend it on the things it wants to spend it on.",No
8688,"I believe we need incentive for the individual, and for business and industry, and I believe the plan that I have submitted, with detailed backing, and which has been approved by a number of our leading economists in the country, is based on projections.",Yes
8689,"conservative projections out for the next five years, that indicates that this plan would, by 1983, result in a balanced budget.",No
8690,"We have to remember, when we talk a tax cut, we're only talking about reducing a tax increase, because this Administration has left us with a built-in tax increase that will amount to $86 billion next year.",Yes
8697,"And since I first made that proposal 15 months ago, the price of gasoline, which was then $.80, has gone up to about $1.30.",Yes
8698,"In other words, we've had a huge increase of about $.50 a gallon since that time, and all of that increase has gone out of this country - or much of it - into the pockets of OPEC oil producers.",Yes
8699,Whereas I have proposed we ought to take.,No
8700,"put that tax on here at home, reduce our consumption of that imported oil.",No
8701,"Recycle those proceeds, then, back into the pockets of the American workers by reducing their tax payments.",No
8702,their Social Security tax payments by 50%.,Yes
8703,"That, I think, in addition, would be an anti-inflationary measure that would strengthen the economy of this country.",No
8705,"Well, I cannot see where a $.50 a gallon tax applied to gasoline would have changed the price of gasoline.",No
8709,Why take it in the first place if you're going to give it back?,No
8711,"And John spoke about 15 years ago, on the position that he.",No
8713,"Fifteen months ago, he was a cosigner and advocating the very tax cut that I am proposing, and said that that would be a forward step in fighting inflation, and that it would be beneficial to the working people of this country.",Yes
8719,"Anything that would preserve, or help us use less energy, that would be fine, and I'm for it.",No
8720,"But I do not believe that conservation alone is the answer to the present energy problem, because all you're doing then is staving off, by a short time, the day when you would come to the end of the energy supply.",No
8722,"The fact is, that in today's oil wells, there is more oil still there than we have so far taken out and used.",Yes
8723,But it would require what is known as secondary or tertiary efforts to bring it out of the ground.,No
8724,"And this is known oil reserves, known supplies.",No
8725,"There are hundreds of millions of acres of land that have been taken out of circulation by the Government for whatever reason they have, that is believed by the most knowledgeable oil geologists to contain probably more oil and natural gas than we have used so far since we drilled that first well 121 years ago.",Yes
8726,"We have a coal supply that is equal to 50% of the world's coal supply, good for centuries, in this country.",Yes
8727,"I grant you that prices may go up, because as you go further and have to go deeper, you are adding to the cost of production.",No
8728,"We have nuclear power, which, I believe, with the safest.",No
8730,All of these things can be done.,No
8732,have leased only 2% of the possible.,Yes
8733,"possibility for oil of the continental shelf around the United States; when you stop to think that the government has taken over 100 million acres of land out of circulation in Alaska, alone, that is believed by geologists to contain much in the line of minerals and energy sources, then I think it is the Government, and the Government with its own restrictions and regulations, that is creating the energy crisis.",Yes
8739,"all we have to do is to get the Government off the back of the oil industry, and that's going to be enough.",No
8740,"I agree with what I think is the major premise of your question, sir, that we are going to have to create a new conservation ethic in the minds of the American people.",No
8741,"and that's simply why I proposed, 15 months ago, the emergency excise tax on gasoline that I did.",Yes
8742,"I did it as a security measure to be sure, because I would rather see us reduce the consumption of imported oil than have to send American boys to fight in the Persian Gulf.",No
8743,"But at the same time, I think it's going to take a dramatic measure of that kind to convince the American people that we will have to reduce the use of the private automobile.",No
8744,We simply cannot have people sitting one behind the wheel of a car in these long traffic jams going in and out of our great cities.,No
8745,"We are going to have to resort to van pooling, to car pooling.",No
8746,"We're going to have to develop better community transportation systems, so that with buses and light rail, we can replace the private automobile in those places where it clearly is not energy-efficient.",No
8747,"I think that, with respect to housing, when we are consuming, even though our per capita income today is about the same as that of the Federal Republic of Germany, we are consuming about, by a factor of two, the amount of energy that they consume in that country.",Yes
8748,"Surely, there are things that we can do in the retrofitting, ;n the redesign of our homes, not only of our houses, but of our commercial structures, as well, that will make it possible for us to achieve.",No
8749,"According to one study that was published a short time ago - the Harvard Business School study - indicated that just in the commercial sector alone of the economy, we could save between 30% and 40% of the energy that we consume in this country today.",Yes
